{
 "features": [
  "log_payable_fraction",
  "specific_throughput_t_h_mw",
  "target_p80_um",
  "circulating_load",
  "water_m3_t",
  "crusher_css_mm",
  "work_index_kwh_t",
  "carrier_liberation_um",
  "grind_to_liberation",
  "carrier_composite_content",
  "carrier_density_t_m3",
  "carrier_floatability",
  "dose_ratio",
  "jg_cm_s",
  "rougher_cells",
  "rougher_volume_m3_per_tph",
  "gravity_bleed",
  "deslime_cut_um",
  "has_flotation",
  "has_gravity",
  "has_magnetic",
  "has_desliming"
 ],
 "targets": [
  "recovery_pct",
  "log_upgrade",
  "specific_energy_total_kwh_t"
 ],
 "feature_mean": [
  -2.461190680478173,
  74.39423715049416,
  164.08331452249695,
  2.500894161852557,
  2.4997437915362752,
  10.000208115019632,
  15.675462001040197,
  132.25969973634923,
  1.3738976959114033,
  0.40479166666667377,
  4.380583333333237,
  0.0002252699737186484,
  3.16077310895523,
  1.3745507242559445,
  6.874348958333333,
  1.469309554414164,
  0.02916666664726404,
  6.539757370694133,
  0.9166666666666666,
  0.08333333333333333,
  0.08333333333333333,
  0.25
 ],
 "feature_scale": [
  1.5158592516682179,
  31.48741606416676,
  70.74185674806155,
  0.86611310195398,
  0.8668032186423499,
  3.462739758938047,
  4.483683080763412,
  52.11279625505751,
  0.7169907259960813,
  0.08143541877190484,
  0.6037828608494442,
  9.746119319811657e-05,
  2.2009027457807204,
  0.6909414735992144,
  3.2604748412965647,
  0.8881185382428016,
  0.10532687210543173,
  12.499958713795131,
  0.27638539919629795,
  0.27638539919629984,
  0.27638539919629795,
  0.4330127018922193
 ],
 "target_mean": [
  74.45934262299018,
  1.2486678888491687,
  13.634152996378647
 ],
 "target_scale": [
  15.107971190625717,
  0.48817391595665344,
  4.807436926064902
 ],
 "guard_feature_mean": [
  -2.461190680478173,
  74.39423715049416,
  164.08331452249695,
  2.500894161852557,
  2.4997437915362752,
  10.000208115019632,
  15.675462001040197,
  132.25969973634923,
  1.3738976959114033,
  0.40479166666667377,
  4.380583333333237,
  0.0002252699737186484,
  3.16077310895523,
  1.3745507242559445,
  6.874348958333333,
  1.469309554414164,
  0.02916666664726404,
  6.539757370694133,
  0.9166666666666666,
  0.08333333333333333,
  0.08333333333333333,
  0.25
 ],
 "guard_feature_scale": [
  1.5158592516682179,
  31.48741606416676,
  70.74185674806155,
  0.86611310195398,
  0.8668032186423499,
  3.462739758938047,
  4.483683080763412,
  52.11279625505751,
  0.7169907259960813,
  0.08143541877190484,
  0.6037828608494442,
  9.746119319811657e-05,
  2.2009027457807204,
  0.6909414735992144,
  3.2604748412965647,
  0.8881185382428016,
  0.10532687210543173,
  12.499958713795131,
  0.27638539919629795,
  0.27638539919629984,
  0.27638539919629795,
  0.4330127018922193
 ],
 "guard_threshold": 0.37216964231852073,
 "reference": [
  {
   "case_id": "copper_porphyry_soft",
   "features": [
    -2.1307682802690238,
    99.03713892709767,
    150.0,
    2.5,
    2.1,
    8.0,
    11.0,
    110.0,
    1.3636363636363635,
    0.35,
    4.19,
    0.00028,
    2.0833333333333335,
    1.4,
    8.0,
    1.4444444444444444,
    0.0,
    0.0,
    1.0,
    0.0,
    0.0,
    0.0
   ],
   "prediction": {
    "recovery_pct": 92.7729468323437,
    "log_upgrade": 1.560869754820027,
    "specific_energy_total_kwh_t": 10.547467207368733
   },
   "guard_error": 0.05246913555553414,
   "guard_flag": false
  },
  {
   "case_id": "copper_porphyry_hard",
   "features": [
    -2.283996656365201,
    69.29347826086956,
    165.0,
    2.5,
    2.1,
    8.0,
    18.5,
    120.0,
    1.375,
    0.42,
    4.19,
    0.00032,
    2.0833333333333335,
    1.4,
    8.0,
    1.5686274509803921,
    0.0,
    0.0,
    1.0,
    0.0,
    0.0,
    0.0
   ],
   "prediction": {
    "recovery_pct": 93.28680214662867,
    "log_upgrade": 1.6971774355353948,
    "specific_energy_total_kwh_t": 16.01512762113578
   },
   "guard_error": 0.022241644509900436,
   "guard_flag": false
  },
  {
   "case_id": "gold_free_milling",
   "features": [
    -5.468521082957745,
    56.89277899343544,
    106.0,
    2.5,
    2.1,
    8.0,
    15.5,
    150.0,
    0.7066666666666667,
    0.5,
    5.01,
    0.0002,
    2.666666666666667,
    1.4,
    7.0,
    1.2115384615384615,
    0.1,
    0.0,
    1.0,
    1.0,
    0.0,
    0.0
   ],
   "prediction": {
    "recovery_pct": 98.28025507655337,
    "log_upgrade": 1.4254931774071176,
    "specific_energy_total_kwh_t": 16.92978151121829
   },
   "guard_error": 0.05588816900112165,
   "guard_flag": false
  },
  {
   "case_id": "iron_magnetite_fine",
   "features": [
    -0.5272435506827877,
    46.7005076142132,
    60.0,
    2.5,
    2.4,
    8.0,
    13.5,
    130.0,
    0.46153846153846156,
    0.5,
    5.18,
    0.0,
    0.0,
    0.0,
    0.0,
    0.0,
    0.0,
    0.0,
    0.0,
    0.0,
    1.0,
    0.0
   ],
   "prediction": {
    "recovery_pct": 84.67063097952158,
    "log_upgrade": 0.33931707065575967,
    "specific_energy_total_kwh_t": 19.951554412924196
   },
   "guard_error": 0.004814976390286629,
   "guard_flag": false
  },
  {
   "case_id": "nickel_sulphide",
   "features": [
    -1.9208187539523751,
    65.95092024539878,
    106.0,
    2.5,
    2.6,
    8.0,
    14.0,
    95.0,
    1.1157894736842104,
    0.35,
    4.8,
    0.00019,
    3.0,
    1.3,
    8.0,
    1.4883720930232558,
    0.0,
    16.0,
    1.0,
    0.0,
    0.0,
    1.0
   ],
   "prediction": {
    "recovery_pct": 76.80305073231074,
    "log_upgrade": 1.194738121220611,
    "specific_energy_total_kwh_t": 15.813746259814025
   },
   "guard_error": 0.05120755550827292,
   "guard_flag": false
  },
  {
   "case_id": "phosphate_clay",
   "features": [
    -0.9430951486635274,
    128.4153005464481,
    150.0,
    2.2,
    2.8,
    8.0,
    8.5,
    280.0,
    0.5357142857142857,
    0.5,
    3.19,
    0.00018,
    2.0,
    1.2,
    7.0,
    1.6382978723404256,
    0.0,
    20.0,
    1.0,
    0.0,
    0.0,
    1.0
   ],
   "prediction": {
    "recovery_pct": 72.95383054676299,
    "log_upgrade": 0.4822691501622439,
    "specific_energy_total_kwh_t": 7.464295613232465
   },
   "guard_error": 0.03269573510956537,
   "guard_flag": false
  },
  {
   "case_id": "copper_molybdenum",
   "features": [
    -2.214670164989233,
    67.65327695560254,
    150.0,
    2.5,
    2.1,
    8.0,
    16.2,
    120.0,
    1.25,
    0.42,
    4.19,
    0.00027,
    2.0833333333333335,
    1.4,
    8.0,
    1.5,
    0.0,
    0.0,
    1.0,
    0.0,
    0.0,
    0.0
   ],
   "prediction": {
    "recovery_pct": 94.51219709204791,
    "log_upgrade": 1.6307819821422214,
    "specific_energy_total_kwh_t": 15.090705106017596
   },
   "guard_error": 0.019755423396995982,
   "guard_flag": false
  },
  {
   "case_id": "copper_oxide",
   "features": [
    -1.978810700930062,
    80.44382801664355,
    140.0,
    2.5,
    2.2,
    8.0,
    12.5,
    90.0,
    1.5555555555555556,
    0.2,
    3.8999999999999995,
    0.00035,
    2.5,
    1.4,
    8.0,
    1.5172413793103448,
    0.0,
    0.0,
    1.0,
    0.0,
    0.0,
    0.0
   ],
   "prediction": {
    "recovery_pct": 76.92130328153051,
    "log_upgrade": 0.9255144765896899,
    "specific_energy_total_kwh_t": 11.373892426913681
   },
   "guard_error": 0.049835743938517425,
   "guard_flag": false
  },
  {
   "case_id": "zinc_sulfide",
   "features": [
    -1.3187587626244128,
    59.54198473282443,
    106.0,
    2.5,
    2.2,
    8.0,
    14.8,
    150.0,
    0.7066666666666667,
    0.35,
    4.05,
    0.0002,
    2.0,
    1.4,
    8.0,
    1.435897435897436,
    0.0,
    0.0,
    1.0,
    0.0,
    0.0,
    0.0
   ],
   "prediction": {
    "recovery_pct": 87.14816137393977,
    "log_upgrade": 1.0196064087326802,
    "specific_energy_total_kwh_t": 16.253903895740155
   },
   "guard_error": 0.048000556276775436,
   "guard_flag": false
  },
  {
   "case_id": "mixed_ore_high_clay",
   "features": [
    -2.318758762624413,
    89.04109589041096,
    150.0,
    2.5,
    2.8,
    8.0,
    13.0,
    120.0,
    1.25,
    0.42,
    4.19,
    0.00024,
    2.0833333333333335,
    1.4,
    8.0,
    1.6923076923076923,
    0.0,
    20.0,
    1.0,
    0.0,
    0.0,
    1.0
   ],
   "prediction": {
    "recovery_pct": 81.64176804307029,
    "log_upgrade": 1.6737333429144594,
    "specific_energy_total_kwh_t": 12.284786839114405
   },
   "guard_error": 0.05559010966263247,
   "guard_flag": false
  },
  {
   "case_id": "low_grade_copper",
   "features": [
    -2.537602002101044,
    79.3201133144476,
    180.0,
    2.5,
    2.1,
    8.0,
    15.5,
    120.0,
    1.5,
    0.42,
    4.19,
    0.00032,
    2.0833333333333335,
    1.4,
    8.0,
    1.4285714285714286,
    0.0,
    0.0,
    1.0,
    0.0,
    0.0,
    0.0
   ],
   "prediction": {
    "recovery_pct": 92.02600833959237,
    "log_upgrade": 1.943321669308459,
    "specific_energy_total_kwh_t": 13.019598282027543
   },
   "guard_error": 0.0357088844846573,
   "guard_flag": false
  },
  {
   "case_id": "refractory_gold",
   "features": [
    -5.657577319177793,
    49.839228295819936,
    106.0,
    2.5,
    2.2,
    8.0,
    18.0,
    102.0,
    1.0392156862745099,
    0.42750000000000005,
    5.487,
    0.000153,
    2.696629213483146,
    1.4,
    8.0,
    1.8064516129032258,
    0.0,
    0.0,
    1.0,
    0.0,
    0.0,
    0.0
   ],
   "prediction": {
    "recovery_pct": 92.67053236956812,
    "log_upgrade": 1.1047277623641403,
    "specific_energy_total_kwh_t": 19.33548258305136
   },
   "guard_error": 0.024575781449181912,
   "guard_flag": false
  }
 ]
}
